intent,snippet
mapping a nested list with list comprehension in python?,nested_list = [[s.upper() for s in xs] for xs in nested_list]
sort list `li` in descending order based on the second element of each list inside list`li`,"sorted(li, key=operator.itemgetter(1), reverse=True)"
image library: how to combine 4 images into a 2 x 2 grid?,"blank_image = Image.new('RGB', (800, 600))"
can a function return an array and a variable?,"my_array, my_variable = my_function()"
case insensitive dictionary search with python,"a_lower = dict((k.lower(), v) for k, v in list(a.items()))"
how to reverse a string using recursion?,return reverse(str1[1:] + str1[0])
sorting associative arrays in python,"sorted(people, key=lambda dct: dct['name'])"
"get a dict of variable names `['some', 'list', 'of', 'vars']` as a string and their values","dict((name, eval(name)) for name in ['some', 'list', 'of', 'vars'])"
"how to check if all values of a dictionary are 0, in python?",all(value == 0 for value in list(your_dict.values()))
sum all values of a counter in python,sum(my_counter.values())
join two lists by interleaving,"map(list, zip(charlist, numlist))"
python max function using 'key' and lambda expression,"max(lis, key=lambda x: x[1])"
"append dict `{'f': var6, 'g': var7, 'h': var8}` to value of key `e` in dict `jsobj['a']['b']`","jsobj['a']['b']['e'].append({'f': var6, 'g': var7, 'h': var8})"
convert currency string `dollars` to decimal `cents_int`,cents_int = int(round(float(dollars.strip('$')) * 100))
map two lists into a dictionary in python,"zip(keys, values)"
sort a list 'lst' in descending order.,"sorted(lst, reverse=True)"
list indexes of duplicate values in a list with python,"print(list_duplicates([1, 2, 3, 2, 1, 5, 6, 5, 5, 5]))"
how to initialise a 2d array in python?,"numpy.zeros((3, 3))"
generate a 12-digit random number,"'%0.12d' % random.randint(0, 999999999999)"
merge two integers in python,z = int(str(x) + str(y))
how to make python format floats with certain amount of significant digits?,"print('%.6g' % (i,))"
create dictionary from list of variables,"dict((k, globals()[k]) for k in ('foo', 'bar'))"
prepend string 'hello' to all items in list 'a',['hello{0}'.format(i) for i in a]
max value within a list of lists of tuple,"map(lambda x: max(x, key=lambda y: y[1]), lists)"
delete the last column of numpy array `a` and assign resulting array to `b`,"b = np.delete(a, -1, 1)"
get the union of values in list of lists `result_list`,return list(set(itertools.chain(*result_list)))
how to make a shallow copy of a list in python,newprefix = list(prefix)
how to efficiently compare two unordered lists (not sets) in python?,len(a) == len(b) and all(a.count(i) == b.count(i) for i in a)
how to read from a zip file within zip file in python?,return zipfile.ZipFile(path)
delete the element 6 from list `a`,a.remove(6)
sorting a list of lists of dictionaries in python,"key = lambda x: sum(map(itemgetter('play'), x))"
how to reverse the elements in a sublist?,[sublist[::-1] for sublist in to_reverse[::-1]]
list comprehension to extract a list of tuples from dictionary,"[(movie_dict['title'], movie_dict['year']) for movie_dict in movie_dicts]"
check if all string elements in list `words` are upper-cased,print(all(word[0].isupper() for word in words))
list of ints into a list of tuples python,"print(zip(my_list[0::2], my_list[1::2]))"
numpy int array: find indices of multiple target ints,"np.where(np.in1d(values, searchvals))"
list duplicated elements in two lists `lista` and `listb`,list(set(listA) & set(listB))
remove identical items from list `my_list` and sort it alphabetically,sorted(set(my_list))
how to convert from boolean array to int array in python,new_data = np.vectorize(boolstr_to_floatstr)(data).astype(float)
how to find duplicate elements in array using for loop in python?,[i for i in y if y[i] == 1]
anaphoric list comprehension in python,[s for s in (square(x) for x in range(12)) if s > 50]
numpy: unexpected result when dividing a vertical array by one of its own elements,"x = np.random.rand(5, 1)"
converting integer to list in python,"map(int, str(num))"
python sort multidimensional array based on 2nd element of subarray,"sorted(lst, key=operator.itemgetter(1), reverse=True)"
get keys from a dictionary 'd' where the value is '1'.,"print([key for key, value in list(d.items()) if value == 1])"
finding index of the same elements in a list,[i for i in range(len(word)) if word[i] == letter]
getting a dictionary value where part of the key is in a string,"{i: functools.reduce(dict.__getitem__, keys, d[i]) for i in d}"
return a random word from a word list in python,return random.choice(words)
a list as a key for pyspark's reducebykey,"rdd.map(lambda k_v: (tuple(k_v[0]), k_v[1])).groupByKey()"
get the directory path of absolute file path in python,os.path.dirname(fullpath)
sort a multidimensional list by a variable number of keys,"a.sort(key=operator.itemgetter(2, 3))"
how do i fill two (or more) numpy arrays from a single iterable of tuples?,"arr.sort(order=['f0', 'f1'])"
convert generator object to a dictionary,{i: (i * 2) for i in range(10)}
python - fastest way to check if a string contains specific characters in any of the items in a list,[(e in lestring) for e in lelist if e in lestring]
"get list of string elements in string `data` delimited by commas, putting `0` in place of empty strings","[(int(x) if x else 0) for x in data.split(',')]"
python: one-liner to perform an operation upon elements in a 2d array (list of lists)?,"[list(map(int, x)) for x in values]"
how to count the total number of lines in a text file using python,count = sum(1 for line in myfile if line.rstrip('\n'))
two combination lists from one list,"print([[l[:i], l[i:]] for i in range(1, len(l))])"
empty a list `lst`,lst[:] = []
how can i get an array of alternating values in python?,"np.resize([1, -1], 10)"
how to create a numpy array of all true or all false?,"array([[True, True], [True, True]], dtype=bool)"
sort list of date strings,"sorted(d, key=lambda x: datetime.datetime.strptime(x, '%m-%Y'))"
create tuples containing elements that are at the same index of list `lst` and list `lst2`,"[(i, j) for i, j in zip(lst, lst2)]"
how do you programmatically set an attribute in python?,"setattr(x, attr, 'magic')"
can i use a class attribute as a default value for an instance method?,my_instance = MyClass(name='new name')
removing items from a nested list python,[[j for j in families[i] if i != j] for i in range(len(families))]
python sorting list of dictionaries by multiple keys,"mylist = sorted(mylist, key=lambda k: (k['name'].lower(), -k['age']))"
sorting a list of tuples with multiple conditions,"sorted_by_length = sorted(list_, key=lambda x: (x[0], len(x[1]), float(x[1])))"
split a string into 2 in python,"firstpart, secondpart = string[:len(string) / 2], string[len(string) / 2:]"
cross product of a vector in numpy,"np.cross(a, b, axis=0)"
order a list of lists `l1` by the first value,l1.sort(key=lambda x: int(x[0]))
how to get the indices list of all nan value in numpy array?,"array([[1, 2], [2, 0]])"
merge two lists `a` and `b` into a single list,"[j for i in zip(a, b) for j in i]"
"sort list of strings `the_list` by integer suffix before ""_""","sorted(the_list, key=lambda x: int(x.split('_')[1]))"
how do i sort a python list of time values?,"sorted(['14:10:01', '03:12:08'])"
sorting python list based on the length of the string,"xs.sort(lambda x, y: cmp(len(x), len(y)))"
how to get the concrete class name as a string?,instance.__class__.__name__
pythonic way to filter list for elements with unique length,list({len(s): s for s in jones}.values())
convert numbers to grades in python list,"li = map(lambda x: '{0} - {1}'.format(x, grade(x)), s)"
python: create list of tuples from lists,"z = zip(x, y)"
building up an array in numpy/scipy by iteration in python?,"array([0, 1, 4, 9, 16])"
"check if  dictionary `d` contains all keys in list `['somekey', 'someotherkey', 'somekeyggg']`","all(word in d for word in ['somekey', 'someotherkey', 'somekeyggg'])"
convert list of tuples to multiple lists in python,"map(list, zip(*[(1, 2), (3, 4), (5, 6)]))"
"list all "".txt"" files of a directory ""/home/adam/""",print(glob.glob('/home/adam/*.txt'))
5 maximum values in a python dictionary,"max(A, key=A.get)"
"in python, how to join a list of tuples into one list?",b = [i for sub in a for i in sub]
index the first and the last n elements of a list,l[:3] + l[-3:]
equivalent of j in numpy,np.array([1j])
how to check if string has the same characters in python,len(set('aaaa')) == 1
list comprehension that produces integers between 11 and 19,[i for i in range(100) if i > 10 if i < 20]
how to add a new row to an empty numpy array,"arr = np.append(arr, np.array([[4, 5, 6]]), axis=0)"
adding values from tuples of same length,"coord = tuple(sum(x) for x in zip(coord, change))"
how to check if a column exists in pandas,df['sum'] = df['A'] + df['C']
python print array with new line,print('\n'.join(op))
how to avoid python/pandas creating an index in a saved csv?,"pd.to_csv('your.csv', index=False)"
how to remove multiple columns that end with same text in pandas?,"df.select(lambda x: re.search('prefix$', str(x)) is None, axis=1)"
what pandas data type is passed to transform or apply in a groupby,"df.groupby(['category'])[['data_1', 'data_2']].transform(f)"
divide the values of two dictionaries in python,{k: (float(d2[k]) / d1[k]) for k in d2}
check if all values of iterable are zero,list(l) == [0] * len(l)
"check if ""blah"" is in string `somestring`","if ('blah' not in somestring):
    pass"
how to convert a list of multiple integers into a single integer?,"x = [1, 3, 5]"
reverse string 'foo',''.join(reversed('foo'))
how to merge two dataframe in pandas to replace nan,"a.where(~np.isnan(a), other=b, inplace=True)"
how do i add space between two variables after a print in python,print(str(count) + '  ' + str(conv))
how to convert a hex string to hex number,print(hex(new_int)[2:])
python json encoding,"json.dumps({'apple': 'cat', 'banana': 'dog', 'pear': 'fish'})"
extract values not equal to 0 from numpy array `a`,a[a != 0]
splitting a string based on a certain set of words,"re.split('_(?:for|or|and)_', 'sad_pandas_and_happy_cats_for_people')"
pandas: best way to select all columns starting with x,"df.filter(regex='^foo\\.', axis=1)"
how to write text on a image in windows using python opencv2,"cv2.putText(image, 'Hello World!!!', (x, y), cv2.FONT_HERSHEY_SIMPLEX, 2, 255)"
pandas: check if row exists with certain values,((df['A'] == 1) & (df['B'] == 2)).any()
get `3` unique items from a list,"random.sample(list(range(1, 16)), 3)"
python convert list to dictionary,"dict([['two', 2], ['one', 1]])"
get the canonical path of file `path`,os.path.realpath(path)
split a list into parts based on a set of indexes in python,"[[0, 1, 2, 3, 4], [5, 6, 7, 8, 9, 10, 11], [12, 13, 14, 15, 16], [17, 18, 19]]"
count occurrences of number by column in pandas data frame,(df == 1).sum()
convert list of dictionaries `l` into a flat dictionary,dict(pair for d in L for pair in list(d.items()))
subset of dictionary keys,{v[0]: data[v[0]] for v in list(by_ip.values())}
calculating difference between two rows in python / pandas,data.set_index('Date').diff()
add column sum as new column in pyspark dataframe,"newdf = df.withColumn('total', sum(df[col] for col in df.columns))"
"reorder indexed rows `['z', 'c', 'a']` based on a list in pandas data frame `df`","df.reindex(['Z', 'C', 'A'])"
return rows of data associated with the maximum value of column 'value' in dataframe `df`,df.loc[df['Value'].idxmax()]
set index equal to field 'trx_date' in dataframe `df`,df = df.set_index(['TRX_DATE'])
how to merge two columns together in pandas,"pd.melt(df, id_vars='Date')[['Date', 'value']]"
pandas: how to run a pivot with a multi-index?,"df.groupby(['year', 'month', 'item'])['value'].sum().unstack('item')"
drop column based on a string condition,"df.drop(df.columns[df.columns.str.match('chair')], axis=1)"
add leading zeros to strings in pandas dataframe,df['ID'] = df['ID'].apply(lambda x: '{0:0>15}'.format(x))
"add row `['8/19/2014', 'jun', 'fly', '98765']` to dataframe `df`","df.loc[len(df)] = ['8/19/2014', 'Jun', 'Fly', '98765']"
plotting categorical data with pandas and matplotlib,df.colour.value_counts().plot(kind='bar')
how to sort pandas data frame using values from several columns?,"df.sort(['c1', 'c2'], ascending=[False, True])"
python pandas dataframe slicing by date conditions,df.sort_index()
python pandas - how to flatten a hierarchical index in columns,df.columns = df.columns.get_level_values(0)
python pandas: replace values multiple columns matching multiple columns from another dataframe,"df2.rename(columns={'OCHR': 'chr', 'OSTOP': 'pos'}, inplace=True)"
replace rarely occurring values in a pandas dataframe,g = df.groupby('column_name')
how to replace values with none in pandas data frame in python?,"df.replace('-', np.nan)"
create new columns in pandas from python nested lists,"df.A.apply(lambda x: pd.Series(1, x)).fillna(0).astype(int)"
how to flatten a pandas dataframe with some columns as json?,"df[['id', 'name']].join([A, B])"
how to do pearson correlation of selected columns of a pandas data frame,"df.corr().iloc[:-1, (-1)]"
append to file 'test1' content 'koko',"with open('test1', 'ab') as f:
    pass"
merge column  'word' in dataframe `df2` with column 'word' on dataframe `df1`,"df1.merge(df2, how='left', on='word')"
read pandas data frame csv `comma.csv` with extra commas in column specifying string delimiter `'`,"df = pd.read_csv('comma.csv', quotechar=""'"")"
"how to duplicate rows in pandas, based on items in a list",df['data'] = df['data'].apply(clean_string_to_list)
reading gps rinex data with pandas,"df.set_index(['%_GPST', 'satID'])"
"search for ""does-not-contain"" on a dataframe in pandas",~df['col'].str.contains(word)
how to group dataframe by a period of time?,"df.groupby([df['Source'], pd.TimeGrouper(freq='Min')])"
select dataframe rows between two dates,df['date'] = pd.to_datetime(df['date'])
pandas create new column based on values from other columns,"df.apply(lambda row: label_race(row), axis=1)"
pandas: best way to select all columns starting with x,df.columns.map(lambda x: x.startswith('foo'))
how to extract tuple values in pandas dataframe for use of matplotlib?,"pd.pivot(index=df['B1'], columns=df.index, values=df['B2']).plot()"
pandas remove column by index,"df = df.ix[:, 0:2]"
rename index of a pandas dataframe,"df.ix['c', '3']"
pandas subtract a row from dataframe `df2` from dataframe `df`,"pd.DataFrame(df.values - df2.values, columns=df.columns)"
compare two columns using pandas,df2 = df.astype(float)
combining rows in pandas,df.reset_index().groupby('city_id').sum()
pandas + dataframe - select by partial string,df[df['A'].str.contains('hello')]
get a list of all the duplicate items in dataframe `df` using pandas,"pd.concat(g for _, g in df.groupby('ID') if len(g) > 1)"
create new column `a_perc` in dataframe `df` with row values equal to the value in column `a` divided by the value in column `sum`,df['A_perc'] = df['A'] / df['sum']
python pandas - how to flatten a hierarchical index in columns,pd.DataFrame(df.to_records())
"how to use applymap, lambda and dataframe together to filter / modify dataframe in python?",df.fillna('o')
convert column of date objects in pandas dataframe to strings,df['A'].apply(lambda x: x.strftime('%d%m%Y'))
how to give a pandas/matplotlib bar graph custom colors,"df.plot(kind='bar', stacked=True, color=my_colors)"
how to swap a group of column headings with their values in pandas,"df = df.assign(a5=['Foo', 'Bar', 'Baz'])"
dropping a single (sub-) column from a multiindex,"df.drop('a', level=1, axis=1)"
select all rows in dataframe `df` where the values of column 'columnx' is bigger than or equal to `x` and smaller than or equal to `y`,df[(x <= df['columnX']) & (df['columnX'] <= y)]
how to sort a dataframe in python pandas by two or more columns?,"df.sort_values(['a', 'b'], ascending=[True, False])"
pandas groupby: how to get a union of strings,"df.groupby('A')['C'].apply(lambda x: '{%s}' % ', '.join(x))"
combining rows in pandas,df.groupby(df.index).sum()
concatenate dataframe `df_1` to dataframe `df_2` sorted by values of the column 'y',"pd.concat([df_1, df_2.sort_values('y')])"
calcuate mean for selected rows for selected columns in pandas data frame,"df[['b', 'c']].iloc[[2, 4]].mean(axis=0)"
python pandas - how to flatten a hierarchical index in columns,[' '.join(col).strip() for col in df.columns.values]
pandas: joining items with same index,"df.assign(id=df.groupby([0]).cumcount()).set_index(['id', 0]).unstack(level=1)"
pandas to_csv call is prepending a comma,df.to_csv('c:\\data\\t.csv')
replacing 'abc' and 'ab' values in column 'brandname' of dataframe `df` with 'a',"df['BrandName'].replace(['ABC', 'AB'], 'A')"
how can i replace all the nan values with zero's in a column of a pandas dataframe,df.fillna(0)
python pandas write to sql with nan values,"df2 = df.astype(object).where(pd.notnull(df), None)"
python pandas identify duplicated rows with additional column,"df.groupby(['PplNum', 'RoomNum']).cumcount() + 1"
extract dictionary values by key 'feature3' from data frame `df`,feature3 = [d.get('Feature3') for d in df.dic]
append string 'str' at the beginning of each value in column 'col' of dataframe `df`,df['col'] = 'str' + df['col'].astype(str)
filter pyspark dataframe column with none value,df.filter('dt_mvmt is NULL')
how to deal with settingwithcopywarning in pandas?,"df.ix[0, 'a'] = 3"
convert rows in pandas data frame `df` into list,"df.apply(lambda x: x.tolist(), axis=1)"
apply multiple functions to multiple groupby columns,df.groupby('GRP').agg(f)
access index of last element in data frame,df['date'][df.index[-1]]
pandas: selection with multiindex,df[pd.Series(df.index.get_level_values('A')).isin(vals[vals['values']].index)]
replace nan values in a pandas data frame with the average of columns,"df.apply(lambda x: x.fillna(x.mean()), axis=0)"
remove dollar sign '$' from second to last column data in dataframe 'df' and convert the data into floats,"df[df.columns[1:]].replace('[\\$,]', '', regex=True).astype(float)"
how to group dataframe by a period of time?,df.groupby(df.index.map(lambda t: t.minute))
how to append rows in a pandas dataframe in a for loop?,print('{}\n'.format(df))
python numpy: cannot convert datetime64[ns] to datetime64[d] (to use with numba),df['month_15'].astype('datetime64[D]').tolist()
find numeric columns in pandas (python),df._get_numeric_data()
pandas subtract dataframe with a row from another dataframe,"pd.DataFrame(df.values - df2.values, columns=df.columns)"
flatten a dataframe df to a list,df.values.flatten()
convert float series into an integer series in pandas,"df.resample('1Min', how=np.mean)"
pandas - make a column dtype object or factor,df['col_name'] = df['col_name'].astype('category')
pandas groupby: how to get a union of strings,df.groupby('A')['B'].agg(lambda col: ''.join(col))
adding up all columns in a dataframe,df['sum'] = df.sum(axis=1)
python pandas extract unique dates from time series,df['Date'][0].date()
replace '-' in pandas dataframe `df` with `np.nan`,"df.replace('-', np.nan)"
remove square bracket '[]' from pandas dataframe `df` column 'value',df['value'] = df['value'].str.strip('[]')
pandas: how do i select first row in each group by group?,df.drop_duplicates(subset='A')
break values of one column into two columns,df['last_updated_time'] = d.dt.strftime('%H:%M:%S')
faster way to remove outliers by group in large pandas dataframe,grouped = df.groupby(level='DATE')
add multiple columns to pandas dataframe from function,"df[['hour', 'weekday', 'weeknum']] = df.apply(lambdafunc, axis=1)"
set values on the diagonal of pandas.dataframe,"np.fill_diagonal(df.values, 0)"
python : getting the row which has the max value in groups using groupby,"df.groupby(['Mt'], sort=False)['count'].max()"
write dataframe `df` to csv file 'mycsv.csv',df.write.csv('mycsv.csv')
how to calculate quantiles in a pandas multiindex dataframe?,"df.groupby(level=[0, 1]).median()"
multiply column 'a' and column 'b' by column 'c' in datafram `df`,"df[['A', 'B']].multiply(df['C'], axis='index')"
convert pandas dataframe `df` to a dictionary using `id` field as the key,df.set_index('id').to_dict()
"get  value at index `[2, 0]` in dataframe `df`","df.iloc[2, 0]"
applying functions to groups in pandas dataframe,df.groupby('type').apply(foo)
convert nan values to 'n/a' while reading rows from a csv `read_csv` with pandas,"df = pd.read_csv('my.csv', na_values=['n/a'])"
reading a csv into pandas where one column is a json string,"df = pandas.read_csv(f1, converters={'stats': CustomParser}, header=0)"
how to remove duplicates from a dataframe?,"df = pd.DataFrame({'a': [1, 2, 3, 3, 3], 'b': [1, 2, None, 1, None]})"
python pandas: drop rows of a timeserie based on time range,"pd.concat([df[:start_remove], df[end_remove:]])"
grouping pandas dataframe by n days starting in the begining of the day,df['dateonly'] = df['time'].apply(lambda x: x.date())
replace parentheses and all data within it with empty string '' in column 'name' of dataframe `df`,"df['name'].str.replace('\\(.*\\)', '')"
"using pandas, how do i subsample a large dataframe by group in an efficient manner?",subsampled = df.ix[(choice(x) for x in list(grouped.groups.values()))]
summarizing dataframe into a dictionary,df.groupby('date')['level'].first().apply(np.ceil).astype(int).to_dict()
make new column 'c' in panda dataframe by adding values from other columns 'a' and 'b',df['C'] = df['A'] + df['B']
splitting dictionary/list inside a pandas column into separate columns,"pd.concat([df.drop('b', axis=1), pd.DataFrame(df['b'].tolist())], axis=1)"
changing time frequency in pandas dataframe,"new = df.resample('T', how='mean')"
how to generate all possible strings in python?,"map(''.join, itertools.product('ABC', repeat=3))"
fastest way of deleting certain keys from dict in python,"dict((k, v) for k, v in somedict.items() if not k.startswith('someprefix'))"
removing items from unnamed lists in python,[item for item in my_sequence if item != 'item']
resampling within a pandas multiindex,df['Date'] = pd.to_datetime(df['Date'])
convert generator object to a dictionary,{i: (i * 2) for i in range(10)}
how to select specific columns in numpy array?,"A = np.delete(A, 50, 1)"
how can i split and parse a string in python?,print(mystring.split(' '))
rename index of a pandas dataframe,df.ix['c']
"pythonic way to fetch all elements in a dictionary, falling between two keys?","dict((k, v) for k, v in parent_dict.items() if 2 < k < 4)"
specific sort a list of numbers separated by dots,"print(sorted(L, key=lambda x: int(x.split('.')[2])))"
split a string by backslash in python,print(a.split('\\'))
replace value 0 with 'female' and value 1 with 'male' in column 'sex' of dataframe `data`,"data['sex'].replace([0, 1], ['Female', 'Male'], inplace=True)"
"convert tuple elements in list `[(1,2),(3,4),(5,6),]` into lists","map(list, zip(*[(1, 2), (3, 4), (5, 6)]))"
python: rename single column header in pandas dataframe,"data.rename(columns={'gdp': 'log(gdp)'}, inplace=True)"
summing 2nd list items in a list of lists of lists,[sum(zip(*x)[1]) for x in data]
how to post data structure like json to flask?,content = request.json['content']
how do i remove the background from this kind of image?,cv2.waitKey()
"remove all instances of `[1, 1]` from a list `a`","[x for x in a if x != [1, 1]]"
easiest way to replace a string using a dictionary of replacements?,"from functools import reduce
reduce(lambda x, y: x.replace(y, dict[y]), dict, s)"
remove multiple values from [list] dictionary python,"{k: [x for x in v if x != 'x'] for k, v in myDict.items()}"
how to print dataframe without index,print(df.to_string(index=False))
remove items from a list while iterating without using extra memory in python,li = [x for x in li if condition(x)]
how to remove parentheses and all data within using pandas/python?,"df['name'].str.replace('\\(.*\\)', '')"
convert a list of lists `list_of_lists` into a list of strings keeping empty sub-lists as empty string '',[''.join(l) for l in list_of_lists]
how do you select choices in a form using python?,forms[3]['sex'] = 'male'
switching keys and values in a dictionary in python,"dict((v, k) for k, v in my_dict.items())"
check if elements in list `my_list` are coherent in order,"return my_list == list(range(my_list[0], my_list[-1] + 1))"
"open image ""picture.jpg""","img = Image.open('picture.jpg')
Img.show"
replace values in pandas series with dictionary,s.replace({'abc': 'ABC'})
multi index sorting in pandas,"df.sort([('Group1', 'C')], ascending=False)"
how do i sort a list with positives coming before negatives with values sorted respectively?,"sorted(lst, key=lambda x: (x < 0, x))"
how to multiply two vector and get a matrix?,"numpy.outer(numpy.array([1, 2]), numpy.array([3, 4]))"
convert list of tuples to list?,[i[0] for i in e]
calculate the mean of columns with same name in dataframe `df`,"df.groupby(by=df.columns, axis=1).mean()"
saving a video capture in python with opencv : empty video,cap = cv2.VideoCapture(0)
sorting values of python dict using sorted builtin function,"sorted(list(mydict.values()), reverse=True)"
what is the most efficient way to check if a value exists in a numpy array?,"np.any(my_array[:, (0)] == value)"
how can i extract all values from a dictionary in python?,list(d.values())
merge dictionaries form array `dicts` in a single expression,"dict((k, v) for d in dicts for k, v in list(d.items()))"
how can i fill out a python string with spaces?,"print(""'%-100s'"" % 'hi')"
indexing numpy array with another numpy array,a[tuple(b)]
index the first and the last n elements of a list,l[:3] + l[-3:]
"pandas read_csv expects wrong number of columns, with ragged csv file",pd.read_csv('D:/Temp/tt.csv')
