intent,snippet
get the index value in list `p_list` using enumerate in list comprehension,"{p.id: {'id': p.id, 'position': ind} for ind, p in enumerate(p_list)}"
read excel file `file_name` using pandas,"dfs = pd.read_excel(file_name, sheetname=None)"
how to rearrange pandas column sequence?,"['a', 'b', 'x', 'y']"
python float to in int conversion,int(float('20.0'))
how to check if a variable is empty in python?,return bool(value)
"how do you use pandas.dataframe columns as index, columns, and values?","df.pivot(index='a', columns='b', values='c')"
checking if a variable belongs to a class in python,'b' in list(Foo.__dict__.values())
join pandas data frame `frame_1` and `frame_2` with left join by `county_id` and right join by `countyid`,"pd.merge(frame_1, frame_2, left_on='county_ID', right_on='countyid')"
how to check if a value exists in a dictionary (python),'one' in iter(d.values())
how to get the value of multiple maximas in an array in python,"[0, 16, 17, 18]"
remove list from list in python,new_list.append(fruit)
how to filter a numpy array with another array's values,a[f]
get a name of function `my_function` as a string,my_function.__name__
"difference between using commas, concatenation, and string formatters in python","print('I am printing {x} and {y}'.format(x=x, y=y))"
numpy - efficient conversion from tuple to array?,"np.array(x).reshape(2, 2, 4)[:, :, (0)]"
how to write unix end of line characters in windows using python,"f = open('file.txt', 'wb')"
python pandas how to select rows with one or more nulls from a dataframe without listing columns explicitly?,df[pd.isnull(df).any(axis=1)]
numpy matrix vector multiplication,"np.einsum('ji,i->j', a, b)"
is there a python method to re-order a list based on the provided new indices?,L = [L[i] for i in ndx]
change nan values in dataframe `df` using preceding values in the frame,"df.fillna(method='ffill', inplace=True)"
how can i convert a python dictionary to a list of tuples?,"[(v, k) for k, v in list(d.items())]"
numpy: how to check if array contains certain numbers?,"numpy.in1d(b, a).all()"
"sum of sums of each list, in a list of lists named 'lists'.",sum(sum(x) for x in lists)
"how do you use pandas.dataframe columns as index, columns, and values?","df.pivot_table(index='a', columns='b', values='c', fill_value=0)"
manipulating binary data in python,print(' '.join([str(ord(a)) for a in data]))
set value for particular cell in pandas dataframe,df['x']['C'] = 10
subsetting a 2d numpy array,"np.meshgrid([1, 2, 3], [1, 2, 3], indexing='ij')"
how to modify elements of iterables with iterators? i.e. how to get write-iterators in python?,"[[1, 2, 5], [3, 4, 5]]"
how to generate unique equal hash for equal dictionaries?,hash(pformat(a)) == hash(pformat(b))
reverse a string `string`,''.join(reversed(string))
how to mask numpy structured array on multiple columns?,A[(A['segment'] == 42) & (A['material'] == 5)]
pandas series to excel,"s.to_frame(name='column_name').to_excel('xlfile.xlsx', sheet_name='s')"
pandas: aggregate based on filter on another column,"df.groupby(['Fruit', 'Month'])['Sales'].sum().unstack('Month', fill_value=0)"
sorting list of list in python,[sorted(item) for item in data]
is there a python method to re-order a list based on the provided new indices?,"[L[i] for i in [2, 1, 0]]"
creating a list of objects in python,simplelist = [SimpleClass(count) for count in range(4)]
how can i ensure that my python regular expression outputs a dictionary?,"json.loads('{""hello"" : 4}')"
set multi index of an existing data frame in pandas,"df.set_index(['Company', 'date'], inplace=True)"
converting datetime.date to utc timestamp in python,"timestamp = (dt - datetime(1970, 1, 1)) / timedelta(seconds=1)"
"remove all values within one list `[2, 3, 7]` from another list `a`","[x for x in a if x not in [2, 3, 7]]"
calcuate mean for selected rows for selected columns in pandas data frame,"df.iloc[[0, 2, 3], [0, 1, 3]].mean(axis=0)"
what's the best way to aggregate the boolean values of a python dictionary?,all(dict.values())
how to convert false to 0 and true to 1 in python,x = int(x == 'true')
convert csv file `result.csv` to pandas dataframe using separator ' ',"df.to_csv('Result.csv', index=False, sep=' ')"
python: how to generate a 12-digit random number?,"'%0.12d' % random.randint(0, 999999999999)"
finding the minimum value in a numpy array and the corresponding values for the rest of that array's row,"a[np.argmin(a[:, (1)]), 0]"
plot a bar graph from the column 'color' in the dataframe 'df',df.colour.value_counts().plot(kind='bar')
transforming the string `s` into dictionary,"dict(map(int, x.split(':')) for x in s.split(','))"
count the number of occurrence of values based on another column,df.Country.value_counts().reset_index(name='Sum of Accidents')
custom python list sorting,alist.sort(key=lambda x: x.foo)
tweaking axis labels and names orientation for 3d plots in matplotlib,plt.show()
how can i vectorize this triple-loop over 2d arrays in numpy?,"np.einsum('im,jm,km->ijk', x, y, z)"
how to repeat pandas data frame?,pd.concat([x] * 5)
sorting a list of tuples by the addition of second and third element of the tuple,"sorted(lst, key=lambda x: (-sum(x[1:]), x[0]))"
create new string with unique characters from `s` seperated by ' ',print(' '.join(OrderedDict.fromkeys(s)))
index 2d numpy array by a 2d array of indices without loops,"array([[0, 0], [1, 1], [2, 2]])"
get the number of nan values in each column of dataframe `df`,df.isnull().sum()
multiplying rows and columns of python sparse matrix by elements in an array,"numpy.dot(numpy.dot(a, m), a)"
plotting different colors in matplotlib,plt.show()
sorting alphanumerical dictionary keys in python,"keys.sort(key=lambda k: (k[0], int(k[1:])))"
how to sort a scipy array with order attribute when it does not have the field names?,"x = np.array([(1, 0), (0, 1)])"
python: check if an numpy array contains any element of another array,"np.any(np.in1d(a1, a2))"
list of ints into a list of tuples python,"my_new_list = zip(my_list[0::2], my_list[1::2])"
python dict comprehension with two ranges,"{i: j for i, j in zip(list(range(1, 5)), list(range(7, 11)))}"
sort dictionary `x` by value in ascending order,"sorted(list(x.items()), key=operator.itemgetter(1))"
convert integer to binary,"your_list = map(int, your_string)"
subtract values in one list from corresponding values in another list - python,"C = [(a - b) for a, b in zip(A, B)]"
how to find match items from two lists?,set(data1).intersection(data2)
binarize a float64 pandas dataframe in python,"pd.DataFrame(np.where(df, 1, 0), df.index, df.columns)"
from multiindexed dataframe `data` select columns `a` and `c` within each higher order column `one` and `two`,"data.loc[:, (list(itertools.product(['one', 'two'], ['a', 'c'])))]"
sort dictionary `d` by value in descending order,"sorted(d, key=d.get, reverse=True)"
how to convert nonetype to int or string?,int(0 if value is None else value)
pandas dataframe groupby two columns and get counts,"df.groupby(['col5', 'col2']).size()"
how to sort with lambda in python,"sorted(iterable, cmp=None, key=None, reverse=False)"
read a text file 'very_important.txt' into a string variable `str`,"str = open('very_Important.txt', 'r').read()"
filter duplicate entries w.r.t. value in 'id' from a list of dictionaries 'l',"list(dict((x['id'], x) for x in L).values())"
sorting a 2d list alphabetically?,lst.sort()
clamping floating number `my_value` to be between `min_value` and `max_value`,"max(min(my_value, max_value), min_value)"
pandas dataframe select columns in multiindex,"df.xs('A', level='Col', axis=1)"
filter a dictionary `d` to remove keys with value none and replace other values with 'updated',"dict((k, 'updated') for k, v in d.items() if v is None)"
how to group dataframe by a period of time?,"df.groupby([df.index.map(lambda t: t.minute), 'Source'])"
check if all values of a dictionary `your_dict` are zero `0`,all(value == 0 for value in list(your_dict.values()))
convert backward slash to forward slash in python,"var.replace('\\', '/')"
storing a collection of integers in a list,"[3, 4, 1, 2]"
where's the error in this for loop to generate a list of ordered non-repeated combinations?,"[(1,), (2,), (3,), (1, 2), (1, 3), (2, 3), (1, 2, 3)]"
how can i list the contents of a directory in python?,"print(os.path.join(path, filename))"
converting a pandas groupby object to dataframe,"DataFrame({'count': df1.groupby(['Name', 'City']).size()}).reset_index()"
reshaping array into a square array python,"x.reshape(2, 2, 5).transpose(1, 0, 2)"
how do i remove all punctuation that follows a string?,"""""""words!?.,;:"""""".rstrip('?:!.,;')"
sort a sublist of elements in a list leaving the rest in place,"['X', 'B', 'B1', 'B2', 'B11', 'B21', 'B22', 'C', 'Q1', 'C11', 'C2']"
"combining two lists and removing duplicates, without removing duplicates in original list",print(first_list + list(set(second_list) - set(first_list)))
in python how can i declare a dynamic array,lst.append('a')
pythonic way of removing reversed duplicates in list,data = {tuple(sorted(item)) for item in lst}
correct way to edit dictionary value python,"my_dict.setdefault('foo', {})['bar'] = some_var"
how to unpack a list?,"print(tuple(chain(['a', 'b', 'c'], 'd', 'e')))"
make a function `f` that calculates the sum of two integer variables `x` and `y`,"f = lambda x, y: x + y"
creating a list of objects in python,instancelist = [MyClass() for i in range(29)]
selecting positive certain values from a 2d array in python,"[[0.0, 3], [0.1, 1]]"
extract dictionary value from column in data frame,feature3 = [d.get('Feature3') for d in df.dic]
python summing elements of one dict if the have a similar key(tuple),"{k: sum(v) for k, v in list(trimmed.items())}"
python - how to extract the last x elements from a list,new_list = my_list[-10:]
python(pandas): removing duplicates based on two columns keeping row with max value in another column,"df.groupby(['A', 'B']).max()['C']"
how do i combine two columns within a dataframe in pandas?,df['c'] = df['b'].fillna(df['a'])
sorting dictionary keys based on their values,"sorted(d, key=lambda k: d[k][1])"
comparing elements between elements in two lists of tuples,"[x[0] for x, y in zip(l1, l2) if x[0] == y[0]]"
python repeat string,print('[{0!r}] ({0:_^15})'.format(s[:5]))
updating csv with data from a csv with different formatting,"cdf1.to_csv('temp.csv', index=False)"
call a function with argument list in python,"func(*args, **kwargs)"
set multi index of an existing data frame in pandas,"df = df.set_index(['Company', 'date'], inplace=True)"
how to to filter dict to select only keys greater than a value?,"{k: v for k, v in list(mydict.items()) if k >= 6}"
python: get int value from a char string,"int('AEAE', 16)"
how to print a list more nicely?,"zip([1, 2, 3], ['a', 'b', 'c'], ['x', 'y', 'z'])"
how do you pass arguments from one function to another?,"some_other_function(*args, **kwargs)"
python pandas: plot histogram of dates?,df.date = df.date.astype('datetime64')
printing list in python properly,"print('[%s]' % ', '.join(map(str, mylist)))"
getting one value from a python tuple,i = 5 + Tup()[0]
how can i find all subclasses of a class given its name?,print([cls.__name__ for cls in vars()['Foo'].__subclasses__()])
parse_dates in pandas,"df['date'] = pd.to_datetime(df['date'], format='%d%b%Y')"
pandas dropna - store dropped rows,"df.dropna(subset=['col2', 'col3'])"
get index of the first biggest element in list `a`,a.index(max(a))
how to read file with space separated values,"pd.read_csv('whitespace.csv', header=None, delimiter='\\s+')"
"build a dict of key:value pairs from a string representation of a dict, `{'muffin' : 'lolz', 'foo' : 'kitty'}`","ast.literal_eval(""{'muffin' : 'lolz', 'foo' : 'kitty'}"")"
how to assign a string value to an array in numpy?,"CoverageACol = numpy.array([['a', 'b'], ['c', 'd']], dtype=numpy.dtype('a16'))"
python numpy 2d array indexing,b[a].shape
python: assign each element of a list to a separate variable,"a, b, c = [1, 2, 3]"
how to convert a pandas dataframe subset of columns and rows into a numpy array?,"df[df.c > 0.5][['b', 'e']].values"
map two lists into a dictionary in python,"dict([(k, v) for k, v in zip(keys, values)])"
generating all unique pair permutations,"list(permutations(list(range(9)), 2))"
convert sets to frozensets as values of a dictionary,"d = {k: frozenset(v) for k, v in list(d.items())}"
how to use python pandas to get intersection of sets from a csv file,csv_pd.query('setA==1 & setB==0 & setC==0').groupby('D').count()
pandas dataframe groupby and get nth row,df.groupby('ID').apply(lambda t: t.iloc[1])
how to generate random numbers that are different?,"random.sample(range(1, 50), 6)"
how do i print the content of a .txt file in python?,file_contents = f.read()
split dataframe `df` where the value of column `a` is equal to 'b',df.groupby((df.a == 'B').shift(1).fillna(0).cumsum())
"slicing of a numpy 2d array, or how do i extract an mxm submatrix from an nxn array (n>m)?","x[[[1], [3]], [1, 3]]"
replacing few values in a pandas dataframe column with another value,"df['BrandName'] = df['BrandName'].replace(['ABC', 'AB'], 'A')"
sort a list by the number of occurrences of the elements in the list,"sorted(A, key=key_function)"
get a random boolean in python?,bool(random.getrandbits(1))
best way to remove elements from a list,[item for item in my_list if some_condition()]
joining pairs of elements of a list - python,"[(x[i] + x[i + 1]) for i in range(0, len(x), 2)]"
how do i combine two lists into a dictionary in python?,"dict(zip([1, 2, 3, 4], [a, b, c, d]))"
convert values in dictionary `d` into integers,"{k: int(v) for k, v in d.items()}"
"select a random element from array `[1, 2, 3]`","random.choice([1, 2, 3])"
random decimal in python,decimal.Decimal(random.randrange(10000)) / 100
adding a 1-d array to a 3-d array in numpy,"np.zeros((6, 9, 20)) + np.array([1, 2, 3, 4, 5, 6, 7, 8, 9])[(None), :, (None)]"
how to check if an element exists in a python array (equivalent of php in_array)?,"1 in [0, 1, 2, 3, 4, 5]"
"add multiple columns `hour`, `weekday`, `weeknum` to pandas data frame `df` from lambda function `lambdafunc`","df[['hour', 'weekday', 'weeknum']] = df.apply(lambdafunc, axis=1)"
saving numpy array to csv produces typeerror mismatch,"np.savetxt('test.csv', example, delimiter=',')"
flatten numpy array,np.hstack(b)
how to sort a dictionary in python by value when the value is a list and i want to sort it by the first index of that list,"sorted(list(data.items()), key=lambda x: x[1][0])"
check if type of variable `s` is a string,"isinstance(s, str)"
how do i sort a list of strings in python?,mylist.sort()
numpy: efficiently add rows of a matrix,out = mat[0] * (len(ixs) - len(nzidx)) + mat[ixs[nzidx]].sum(axis=0)
create a list containing the indices of elements greater than 4 in list `a`,"[i for i, v in enumerate(a) if v > 4]"
python: convert a string to an integer,int('  23  ')
fast way to remove a few items from a list/queue,somelist = [x for x in somelist if not determine(x)]
how to group similar items in a list?,"[list(g) for _, g in itertools.groupby(test, lambda x: x.partition('_')[0])]"
removing duplicates of a list of sets,list(set(frozenset(item) for item in L))
combining two sorted lists in python,"[9.743937969207764, 9.884459972381592, 9.552299976348877]"
getting the last element of list `some_list`,some_list[(-1)]
more pythonic/pandorable approach to looping over a pandas series,"pd.Series(np.einsum('ij->i', s.values.reshape(-1, 3)))"
how do i combine two lists into a dictionary in python?,"dict(zip([1, 2, 3, 4], ['a', 'b', 'c', 'd']))"
python list of np arrays to array,np.vstack(dat_list)
read a ragged csv file `d:/temp/tt.csv` using `names` parameter in pandas,"pd.read_csv('D:/Temp/tt.csv', names=list('abcdef'))"
summing 2nd list items in a list of lists of lists,[sum([x[1] for x in i]) for i in data]
how to slice a dataframe having date field as index?,df.index = pd.to_datetime(df['TRX_DATE'])
lambda function don't closure the parameter in python?,lambda i=i: pprint(i)
call base class's __init__ method from the child class `childclass`,"super(ChildClass, self).__init__(*args, **kwargs)"
python using pandas to convert xlsx to csv file. how to delete index column?,"data_xls.to_csv('csvfile.csv', encoding='utf-8', index=False)"
"given two lists in python one with strings and one with objects, how do you map them?",new_list = [d[key] for key in string_list]
find gaps in a sequence of strings,"list(find_gaps(['0000001', '0000003', '0000006']))"
extract array from list in python,"zip((1, 2), (40, 2), (9, 80))"
prevent numpy from creating a multidimensional array,"np.ndarray((2, 3), dtype=object)"
insert element in python list after every nth element,"letters = ['a', 'b', 'c', 'd', 'e', 'f', 'g', 'h', 'i', 'j']"
python - create list with numbers between 2 values?,"list(range(11, 17))"
python pandas flatten a dataframe to a list,df.values.flatten()
create a list containing the `n` next values of generator `it`,[next(it) for _ in range(n)]
sorting by nested dictionary in python dictionary,"a['searchResult'].sort(key=lambda d: d['ranking'], reverse=True)"
pandas dataframe to list,list(set(df['a']))
sort pandas data frame `df` using values from columns `c1` and `c2` in ascending order,"df.sort(['c1', 'c2'], ascending=[True, True])"
how to create a fix size list in python?,[None] * 10
how to loop backwards in python?,"range(10, 0, -1)"
make a copy of list `old_list`,[i for i in old_list]
parse values in text file,"df = pd.read_csv('file_path', sep='\t', error_bad_lines=False)"
read csv file 'my_file.csv' into numpy array,"my_data = genfromtxt('my_file.csv', delimiter=',')"
splitting integer in python?,[int(i) for i in str(12345)]
group dataframe `df` by columns 'month' and 'fruit',"df.groupby(['Month', 'Fruit']).sum().unstack(level=0)"
delete column in pandas based on condition,"df.loc[:, ((df != 0).any(axis=0))]"
in pandas how do i convert a string of date strings to datetime objects and put them in a dataframe?,pd.to_datetime(pd.Series(date_stngs))
generate a random integer between `a` and `b`,"random.randint(a, b)"
how to calculate percentage of sparsity for a numpy array/matrix?,np.prod(a.shape)
input a tuple of integers from user,"tuple(int(x.strip()) for x in input().split(','))"
"round off entries in dataframe `df` column `alabama_exp` to two decimal places, and entries in column `credit_exp` to three decimal places","df.round({'Alabama_exp': 2, 'Credit_exp': 3})"
count number of events in an array python,"1, 0, 0, 1, 0, 0, 0, 1, 1, 0, 0, 0, 0, 0, 0, 1, 1, 0, 1, 1, 1, 0, 0"
elementwise product of 3d arrays `a` and `b`,"np.einsum('ijk,ikl->ijl', A, B)"
splitting a dictionary in python into keys and values,"keys, values = zip(*list(dictionary.items()))"
python zip() function for a matrix,zip(*A)
delete all rows in a numpy array `a` where any value in a row is zero `0`,"a[np.all(a != 0, axis=1)]"
"store integer 3, 4, 1 and 2 in a list","[3, 4, 1, 2]"
reshape pandas dataframe from rows to columns,"pd.concat([df2[df2.Name == 'Jane'].T, df2[df2.Name == 'Joe'].T])"
how to unnest a nested list?,"from functools import reduce
reduce(lambda x, y: x + y, A, [])"
how to use raw_input() with while-loop,i = int(input('>> '))
how to find all occurrences of a pattern and their indices in python,"[x.span() for x in re.finditer('foo', 'foo foo foo foo')]"
how to filter a dictionary according to an arbitrary condition function?,"{k: v for k, v in points.items() if v[0] < 5 and v[1] < 5}"
applying a function to values in dict,"d2 = {k: f(v) for k, v in list(d1.items())}"
convert ndarray with shape 3x3 to array,"np.zeros((3, 3)).ravel()"
how find values in an array that meet two conditions using python,numpy.nonzero((a > 3) & (a < 8))
convert list of strings to dictionary,d[i[0]] = int(i[1])
sum the length of all strings in a list `strings`,length = sum(len(s) for s in strings)
convert a 1d array to a 2d array in numpy,"B = np.reshape(A, (-1, 2))"
pythonic way to associate list elements with their indices,"d = dict((y, x) for x, y in enumerate(t))"
python: how do i make a subclass from a superclass?,"super(MySubClassBetter, self).__init__()"
multiply the columns of sparse matrix `m` by array `a` then multiply the rows of the resulting matrix by array `a`,"numpy.dot(numpy.dot(a, m), a)"
move last item of array `a` to the first position,a[-1:] + a[:-1]
extract row with maximum value in a group pandas dataframe,"df.groupby('Mt', as_index=False).first()"
delete column 'column_name' from dataframe `df`,"df = df.drop('column_name', 1)"
"extracting a region from an image using slicing in python, opencv",cv2.destroyAllWindows()
check if values in a set are in a numpy array in python,"numpy.where(mask, 1, numpy.where(numpy_array == 0, 0, 2))"
round 1123.456789 to be an integer,"print(round(1123.456789, -1))"
using python to add a list of files into a zip file,"ZipFile.write(a, compress_type=zipfile.ZIP_DEFLATED)"
python: how to sort a dictionary by key,"sorted(iter(result.items()), key=lambda key_value: key_value[0])"
ignore an element while building list in python,[r for r in (f(char) for char in string) if r is not None]
how to get a function name as a string in python?,my_function.__name__
sort dataframe `df` based on column 'a' in ascending and column 'b' in descending,"df.sort_values(['a', 'b'], ascending=[True, False])"
"build a dictionary containing the conversion of each list in list `[['two', 2], ['one', 1]]` to a key/value pair as its items","dict([['two', 2], ['one', 1]])"
how to get the n next values of a generator in a list (python),list(next(it) for _ in range(n))
conditional replacement of multiple columns based on column values in pandas dataframe,"df[df.loc[:] == ''] = df.copy().shift(2, axis=1)"
how to convert a python numpy array to an rgb image with opencv 2.4?,"cv2.imshow('image', img)"
how to check if type of a variable is string?,"isinstance(s, str)"
how to do bitwise exclusive or of two strings in python?,"l = [(ord(a) ^ ord(b)) for a, b in zip(s1, s2)]"
sort a list by multiple attributes?,"s.sort(key=operator.itemgetter(1, 2))"
check if character '-' exists in a dataframe `df` cell 'a',df['a'].str.contains('-')
remove trailing newline in string 'test string \n\n','test string \n\n'.rstrip('\n')
how to get unique values with respective occurance count from a list in python?,"[(g[0], len(list(g[1]))) for g in itertools.groupby(['a', 'a', 'b', 'b', 'b'])]"
how to make good reproducible pandas examples,df['date'] = pd.to_datetime(df['date'])
how to obtain all unique combinations of values of particular columns,"df.drop_duplicates(subset=['Col2', 'Col3'])"
python convert list to dictionary,"dict(zip(it, it))"
joining two dataframes from the same source,"df_one.join(df_two, df_one['col1'] == df_two['col1'], 'inner')"
how to specify the endiannes directly in the numpy datatype for a 16bit unsigned integer?,"np.memmap('test.bin', dtype=np.dtype('>u2'), mode='r')"
convert dictionary `dict` into a string formatted object,"'{' + ','.join('{0!r}:{1!r}'.format(*x) for x in list(dct.items())) + '}'"
how to convert pandas dataframe so that index is the unique set of values and data is the count of each value?,df['Qu1'].value_counts()
understanding == applied to a numpy array,np.array([(labels == i).astype(np.float32) for i in np.arange(3)])
algorithm - how to delete duplicate elements in a list efficiently?,M = list(set(L))
get a numpy array that contains the element wise minimum of three 3x1 arrays,"np.array([np.arange(3), np.arange(2, -1, -1), np.ones((3,))]).min(axis=0)"
unpack keys and values of a dictionary `d` into two lists,"keys, values = zip(*list(d.items()))"
insert elements of list `k` into list `a` at position `n`,a = a[:n] + k + a[n:]
how to add border around an image in opencv python,cv2.destroyAllWindows()
python find list lengths in a sublist,[len(x) for x in a[0]]
how to find most common elements of a list?,"['you', 'i', 'a']"
pythonic shorthand for keys in a dictionary?,"{'foo', 'bar', 'baz'}.issubset(list(dct.keys()))"
printing tuple with string formatting in python,"print('this is a tuple: %s' % (thetuple,))"
remove first word in string `s`,"s.split(' ', 1)[1]"
delete all columns in  dataframe `df` that do not hold a non-zero value in its records,"df.loc[:, ((df != 0).any(axis=0))]"
how to remove a column from a structured numpy array *without copying it*?,a[0]
python list comprehension with multiple 'if's,[i for i in range(100) if i > 10 if i < 50]
an elegant way to get hashtags out of a string in python?,set([i[1:] for i in line.split() if i.startswith('#')])
how to make matrices in python?,[x[1] for x in L]
create multiple columns in pandas dataframe from one function,"return pandas.Series({'IV': iv, 'Vega': vega})"
how to get pandas.read_csv() to infer datetime and timedelta types from csv file columns?,"df = pd.read_csv('c:\\temp1.txt', parse_dates=[0], infer_datetime_format=True)"
python getting a list of value from list of dict,[d['value'] for d in l]
fast way to convert strings into lists of ints in a pandas column?,"[3, 2, 1, 0, 3, 2, 3]"
how to plot two columns of a pandas data frame using points?,"df.plot(x='col_name_1', y='col_name_2', style='o')"
sum of all values in a python dict,sum(d.values())
fastest way to drop duplicated index in a pandas dataframe,df[~df.index.duplicated()]
python/numpy: how to get 2d array column length?,a.shape[1]
format strings and named arguments in python,"""""""{} {}"""""".format(10, 20)"
merge dataframes in pandas using the mean,"pd.concat((df1, df2), axis=1).mean(axis=1)"
set the value of cell `['x']['c']` equal to 10 in dataframe `df`,df['x']['C'] = 10
change string `s` to upper case,s.upper()
set max number of threads at runtime on numpy/openblas,"np.dot(x, y)"
how to return all the minimum indices in numpy,numpy.where(x == x.min())
hacking javascript array into json with python,print(json.dumps(result))
