intent,snippet
sort a list of strings based on regular expression match or something similar,"strings.sort(key=lambda str: re.sub('.*%', '', str))"
python: elementwise join of two lists of same length,"[(x + b[i]) for i, x in enumerate(a)]"
how to split a string at line breaks in python?,"print([map(solve, x.split('\t')) for x in s.rstrip().split('\r\n')])"
python program to read a matrix from a given file,"l = [map(int, line.split(',')) for line in f if line.strip() != '']"
how to make a numpy array from an array of arrays?,"np.concatenate(counts_array).reshape(len(counts_array), -1)"
python randomly sort items of the same value,"sorted(a, key=lambda v: (v, random.random()))"
pandas fillna() based on specific column attribute,"df.loc[df['Type'] == 'Dog', ['Killed']]"
get a list comprehension in list of lists `x`,[[X[i][j] for j in range(len(X[i]))] for i in range(len(X))]
convert a string 'mystr' to numpy array of integer values,"print(np.array(list(mystr), dtype=int))"
how to convert this particular json string into a python dictionary?,"json.loads('[{""name"":""sam""}]')"
python- trying to multiply items in list,[i for i in a if i.isdigit()]
revers correlating bits of integer `n`,"int('{:08b}'.format(n)[::-1], 2)"
swap letters in a string in python,return strg[n:] + strg[:n]
finding in elements in a tuple and filtering them,[x for x in l if x[0].startswith('img')]
pandas: elementwise multiplication of two dataframes,"pd.DataFrame(df.values * df2.values, columns=df.columns, index=df.index)"
concatenate elements of a tuple in a list in python,new_data = (' '.join(w) for w in sixgrams)
iterating key and items over dictionary `d`,"for (k, v) in list(d.items()):
    pass"
what is the best way to sort list with custom sorting parameters in python?,li1.sort(key=lambda x: not x.startswith('b.'))
how to build and fill pandas dataframe from for loop?,"pd.DataFrame(d, columns=('Player', 'Team', 'Passer Rating'))"
numpy select fixed amount of values among duplicate values in array,"array([1, 2, 2, 3, 3])"
how to pass a dictionary as value to a function in python,"{'physics': 1}, {'volume': 1, 'chemistry': 1}, {'chemistry': 1}"
convert string to boolean from defined set of strings,"s in ['true', '1', 't', 'y', 'yes', 'yeah', 'yup', 'certainly', 'uh-huh']"
find first item with alphabetical precedence in list with numbers,"min(x for x in lst if isinstance(x, str))"
convert tab-delimited txt file into a csv file using python,"open('demo.txt', 'rb').read()"
avoiding regex in pandas str.replace,"df['a'] = df['a'].str.replace('in.', ' in. ')"
"merge values of same key, in list of dicts","[{'id1': k, 'price': temp[k]} for k in temp]"
how to transform a pair of values into a sorted unique array?,sorted(set().union(*input_list))
precision in python,print('{0:.2f}'.format(your_number))
reverse mapping of dictionary with python,"revdict = dict((v, k) for k, v in list(ref.items()))"
"pandas, filter rows which column contain another column",df[df['B'].str.contains('|'.join(df['A']))]
swap values in a tuple/list inside a list in python?,"map(lambda t: (t[1], t[0]), mylist)"
blank lines in file after sorting content of a text file in python,lines.sort()
delete row based on nulls in certain columns (pandas),"df.dropna(subset=['city', 'latitude', 'longitude'], how='all')"
sorting associative arrays in python,"sorted(people, key=operator.itemgetter('name'))"
python numpy: how to count the number of true elements in a bool array,"sum([True, True, True, False, False])"
get top `3` items from a dictionary `mydict` with largest sum of values,"heapq.nlargest(3, iter(mydict.items()), key=lambda tup: sum(tup[1]))"
how to filter a dictionary according to an arbitrary condition function?,"dict((k, v) for k, v in list(points.items()) if all(x < 5 for x in v))"
how do i pull a recurring key from a json?,print(item['name'])
index confusion in numpy arrays,"A[np.ix_([0, 2], [0, 1], [1, 2])]"
split string `s` into strings of repeating elements,"print([a for a, b in re.findall('((\\w)\\2*)', s)])"
how can i count the occurrences of an item in a list of dictionaries?,sum(1 for d in my_list if d.get('id') == 20)
splitting a list inside a pandas dataframe,"pd.melt(split, id_vars=['a', 'b'], value_name='TimeStamp')"
increment numpy array with repeated indices,"array([0, 0, 2, 1, 0, 1])"
pandas - dataframe expansion with outer join,"df.columns = ['user', 'tweet']"
select everything but a list of columns from pandas dataframe,df[df.columns - ['T1_V6']]
removing nan values from an array,x = x[numpy.logical_not(numpy.isnan(x))]
generate a 12-digit random number,"random.randint(100000000000, 999999999999)"
python finding index of maximum in list,a.index(max(a))
how to convert list of intable strings to int,[[try_int(x) for x in lst] for lst in list_of_lists]
list all the contents of the directory 'path'.,os.listdir('path')
how to round a number to significant figures in python,"round(1234, -3)"
how to set default value to all keys of a dict object in python?,d['foo']
remove certain keys from a dictionary in python,"FieldSet = dict((k, v) for k, v in FieldSet.items() if len(v) != 1)"
what's the simplest way to extend a numpy array in 2 dimensions?,"array([[1, 2, 0], [3, 4, 0]])"
finding index of maximum value in array with numpy,np.where(x == 5)
converting a dict into a list,[y for x in list(dict.items()) for y in x]
how to subset a data frame using pandas based on a group criteria?,df.groupby('User')['X'].filter(lambda x: x.sum() == 0)
counting the number of true booleans in a python list,"sum([True, True, False, False, False, True])"
get the index of the last negative value in a 2d array per column,"np.maximum.accumulate((A2 < 0)[:, ::-1], axis=1)[:, ::-1]"
decoding json string in python,data = json.load(f)
sort dictionary of lists `mydict` by the third item in each list,"sorted(list(myDict.items()), key=lambda e: e[1][2])"
divide each element in list `mylist` by integer `myint`,myList[:] = [(x / myInt) for x in myList]
sorting files in a list,files.sort(key=file_number)
print list of items `mylist`,print('\n'.join(str(p) for p in myList))
array initialization in python,[(i * y + x) for i in range(10)]
how can i read inputs as integers in python?,y = int(eval(input('Enter a number: ')))
how to reliably open a file in the same directory as a python script,print(os.path.dirname(os.path.abspath(sys.argv[0])))
python - how to extract the last x elements from a list,my_list[-10:]
sum all the values in a counter variable `my_counter`,sum(my_counter.values())
flask and sqlalchemy how to delete records from manytomany table?,db.session.commit()
count unique index values in column 'a' in pandas dataframe `ex`,ex.groupby(level='A').agg(lambda x: x.index.get_level_values(1).nunique())
return a random word from a word list 'words',print(random.choice(words))
python: how to generate a 12-digit random number?,'%012d' % random.randrange(10 ** 12)
round number 6.005 up to 2 decimal places,"round(6.005, 2)"
how to extract first two characters from string using regex,"df.c_contofficeID.str.replace('^12(?=.{4}$)', '')"
how to create a range of random decimal numbers between 0 and 1,"[random.random() for _ in range(0, 10)]"
how to get the n next values of a generator in a list (python),"list(itertools.islice(it, 0, n, 1))"
printing each item of a variable on a separate line in python,print('\n'.join(str(port) for port in ports))
using name of list as a string to access list,"x = {'0': [], '2': [], '16': []}"
how to convert ndarray to array?,"np.zeros((3, 3)).ravel()"
python - download images from google image search?,img = Image.open(file)
how to add multiple values to a key in a python dictionary,print(dict(new_dict))
calculate the mean of the nonzero values' indices of dataframe `df`,np.flatnonzero(x).mean()
plot timeseries of histograms in python,"bins = np.linspace(0, 360, 10)"
how to create a number of empty nested lists in python,lst = [[] for _ in range(a)]
"""pythonic"" method to parse a string of comma-separated integers into a list of integers?","mylist = [int(x) for x in '3 ,2 ,6 '.split(',') if x.strip().isdigit()]"
get the number of all keys in a dictionary of dictionaries in python,"n = sum([(len(v) + 1) for k, v in list(dict_test.items())])"
hexadecimal string to byte array in python,bytearray.fromhex('de ad be ef 00')
find maximum with limited length in a list,"[max(abs(x) for x in arr[i:i + 4]) for i in range(0, len(arr), 4)]"
implementing a kolmogorov smirnov test in python scipy,"stats.kstest(np.random.normal(0, 1, 10000), 'norm')"
calculating cumulative minimum with numpy arrays,"numpy.minimum.accumulate([5, 4, 6, 10, 3])"
"is it possible to take an ordered ""slice"" of a dictionary in python based on a list of keys?","res = [(x, my_dictionary[x]) for x in my_list]"
summation of elements of dictionary that are list of lists,"{k: [(a + b) for a, b in zip(*v)] for k, v in list(d.items())}"
convert a string of bytes into an int (python),"int.from_bytes('y\xcc\xa6\xbb', byteorder='little')"
find array corresponding to minimal values along an axis in another array,"np.repeat(np.arange(x), y)"
how to get the symmetric difference of two dictionaries,"dict_symmetric_difference({'a': 1, 'b': 2}, {'b': 2, 'c': 3})"
how can i split a single tuple into multiple using python?,d = {t[0]: t[1:] for t in l}
how to extract all upper from a string? python,""""""""""""".join([c for c in s if c.isupper()])"
find all n-dimensional lines and diagonals with numpy,"np.split(x.reshape(x.shape[0], -1), 9, axis=1)"
"use multiple groupby and agg operations `sum`, `count`, `std` for pandas data frame `df`","df.groupby(level=0).agg(['sum', 'count', 'std'])"
find the index of sub string 'cc' in string 'sdfasdf','sdfasdf'.index('cc')
how can i count the occurrences of an item in a list of dictionaries?,sum(1 for d in my_list if d.get('id') == 1)
efficient way to convert numpy record array to a list of dictionary,"[dict(zip(r.dtype.names, x)) for x in r]"
create list `listy` containing 3 empty lists,listy = [[] for i in range(3)]
how to write a simple bittorrent application?,time.sleep(1)
"from a list of floats, how to keep only mantissa in python?",[(a - int(a)) for a in l]
how to safely open/close files in python 2.4,f.close()
sorting list based on values from another list?,"[x for y, x in sorted(zip(Y, X))]"
trying to converting a matrix 1*3 into a list,my_list = [col for row in matrix for col in row]
get the number of all keys in a dictionary of dictionaries in python,len(dict_test) + sum(len(v) for v in dict_test.values())
how to get all sub-elements of an element tree with python elementtree?,[elem.tag for elem in a.iter()]
python: how to ignore #comment lines when reading in a file,print(line.rstrip())
remove null columns in a dataframe `df`,"df = df.dropna(axis=1, how='all')"
how to read numbers from file in python?,array.append([int(x) for x in line.split()])
unpythonic way of printing variables in python?,"print('{foo}, {bar}, {baz}'.format(**locals()))"
how to calculate moving average in python 3?,"print(sum(map(int, x[num - n:num])))"
python dictionary match key values in two dictionaries,set(aa.items()).intersection(set(bb.items()))
convert string to image in python,"img = Image.new('RGB', (200, 100), (255, 255, 255))"
how to extract nested lists?,list(chain.from_iterable(list_of_lists))
finding the average of a list,sum(l) / float(len(l))
"given a list of variable names in python, how do i a create a dictionary with the variable names as keys (to the variables' values)?","dict((name, locals()[name]) for name in list_of_variable_names)"
"how to write list of strings to file, adding newlines?","data.write('%s%s\n' % (c, n))"
python: how to calculate the sum of a list without creating the whole list first?,sum(a)
python dictionary creation syntax,"d1 = {'yes': [1, 2, 3], 'no': [4]}"
python converting lists into 2d numpy array,"array([[2.0, 18.0, 2.3], [7.0, 29.0, 4.6], [8.0, 44.0, 8.9], [5.0, 33.0, 7.7]])"
"is it possible to take an ordered ""slice"" of a dictionary in python based on a list of keys?","zip(my_list, map(my_dictionary.get, my_list))"
find the newest folder in a directory in python,all_subdirs = [d for d in os.listdir('.') if os.path.isdir(d)]
python: setting an element of a numpy matrix,"a[i, j] = 5"
get unique values from a list in python,mynewlist = list(myset)
writing a pandas dataframe into a csv file with some empty rows,"df.to_csv('pandas_test.txt', header=False, index=False, na_rep=' ')"
python: how to calculate the sum of a list without creating the whole list first?,"result = sum(x for x in range(1, 401, 4))"
"searching if the values on a list is in the dictionary whose format is key-string, value-list(strings)","[key for key, value in list(my_dict.items()) if set(value).intersection(lst)]"
iteration order of sets in python,"set(['a', 'b', 'c'])"
find the coordinates of a cuboid using list comprehension in python,"[list(l) for l in it.product([0, 1], repeat=3) if sum(l) != 2]"
numpy: find the euclidean distance between two 3-d arrays,np.sqrt(((A - B) ** 2).sum(-1))
how to drop duplicate from dataframe taking into account value of another column,"df.drop_duplicates('name', keep='last')"
"add key ""item3"" and value ""3"" to dictionary `default_data `","default_data.update({'item3': 3, })"
python-numpy: apply a function to each row of a ndarray,np.random.seed(1)
how to merge two python dictionaries in a single expression?,"dict((k, v) for d in dicts for k, v in list(d.items()))"
convert python list with none values to numpy array with nan values,"np.array(my_list, dtype=np.float)"
operate on a list in a pythonic way when output depends on other elements,"['*abc', '*de', '*f', '*g']"
get max key in dictionary `mycount`,"max(list(MyCount.keys()), key=int)"
element-wise minimum of multiple vectors in numpy,"np.minimum.reduce([np.arange(3), np.arange(2, -1, -1), np.ones((3,))])"
how to remove two chars from the beginning of a line,[line[2:] for line in lines]
sort a data `a` in descending order based on the `modified` attribute of elements using lambda function,"a = sorted(a, key=lambda x: x.modified, reverse=True)"
"python, zip multiple lists where one list requires two items each","list(zip(a, b, zip(c[0::2], c[1::2]), d))"
distributed programming in python,"print(p.map_async(f, [1, 2, 3]))"
get the path of the python module `amodule`,path = os.path.abspath(amodule.__file__)
convert dictionary `adict` into string,""""""""""""".join('{}{}'.format(key, val) for key, val in sorted(adict.items()))"
how to count the occurrence of certain item in an ndarray in python?,collections.Counter(a)
how to count number of rows in a group in pandas group by object?,"df[['col1', 'col2', 'col3', 'col4']]"
how to indent python list-comprehensions?,[transform(x) for x in results if condition(x)]
removing items from unnamed lists in python,[x for x in something_iterable if x != 'item']
how to remove multiple indexes from a list at the same time?,del my_list[2:6]
inserting an element before each element of a list,[item for sublist in l for item in sublist]
find array corresponding to minimal values along an axis in another array,"np.tile(np.arange(y), x)"
"copy 2d array into 3rd dimension, n times (python)","c = np.array([1, 2, 3])"
finding the first list element for which a condition is true,"next((e for e in mylist if my_criteria(e)), None)"
return the column for value 38.15 in dataframe `df`,"df.ix[:, (df.loc[0] == 38.15)].columns"
create file path from variables,"os.path.join('/my/root/directory', 'in', 'here')"
how to find duplicate elements in array using for loop in python?,[i for i in y if y[i] > 1]
check if all elements in list `mylist` are the same,len(set(mylist)) == 1
how to filter rows of pandas dataframe by checking whether sub-level index value within a list?,df[df.index.levels[0].isin([int(i) for i in stk_list])]
python - remove dictionary from list if key is equal to value,a = [x for x in a if x['link'] not in b]
how to access all dictionaries within a dictionary where a specific key has a particular value,list([x for x in list(all_dicts.values()) if x['city'] == 'bar'])
convert a row in pandas into list,"df.apply(lambda x: x.tolist(), axis=1)"
python pandas: how to move one row to the first row of a dataframe?,df.set_index('a')
python pandas pivot table,"df.pivot_table('Y', rows='X', cols='X2')"
get all indexes of a letter `e` from a string `word`,"[index for index, letter in enumerate(word) if letter == 'e']"
split elements of a list in python,myList = [i.split('\t')[0] for i in myList]
most pythonic way to fit a variable to a range?,"result = min(max_value, max(min_value, result))"
python string and integer concatenation,[('string' + str(i)) for i in range(11)]
finding whether a list contains a particular numpy array,"any(np.array_equal(np.array([[0, 0], [0, 0]]), x) for x in my_list)"
finding the index value of the smallest number in a list?,n.index(min(n))
how to read a csv file in reverse order in python,"print(', '.join(row))"
how to make good reproducible pandas examples,"df = pd.DataFrame([[1, 2], [1, 3], [4, 6]], columns=['A', 'B'])"
simple way of creating a 2d array with random numbers (python),"np.random.random((N, N))"
convert a string of integers `x` separated by spaces to a list of integers,x = [int(i) for i in x.split()]
python: how to normalize a confusion matrix?,C / C.astype(np.float).sum(axis=1)
python merging two lists with all possible permutations,"[list(zip(a, p)) for p in permutations(b)]"
python - how to cut a string in python?,s[:s.rfind('&')]
converting from a string to boolean in python?,str2bool('0')
combine or join numpy arrays,"[(0, 0), (0, 1), (1, 0), (1, 1)]"
finding index of maximum element from python list,"from functools import reduce
reduce(lambda a, b: [a, b], [1, 2, 3, 4])"
how to sort a dataframe in python pandas by two or more columns?,"df1.sort(['a', 'b'], ascending=[True, False])"
convert array `x` into a correlation matrix,np.corrcoef(x)
sort a set `s` by numerical value,"sorted(s, key=float)"
how to count occurences at the end of the list,"print(list_end_counter([1, 2, 1, 1, 1, 1, 1, 1]))"
sort order of lists in multidimensional array in python,"test = sorted(test, key=lambda x: len(x) if type(x) == list else 1)"
python: how to convert a list of dictionaries' values into int/float from string?,"[dict([a, int(x)] for a, x in b.items()) for b in list]"
using multiple indicies for arrays in python,test_rec[(test_rec.age == 1) & (test_rec.sex == 1)]
how to remove positive infinity from numpy array...if it is already converted to a number?,"np.array([fnan, pinf, ninf]) < 0"
how to copy files to network path or drive using python,"shutil.copyfile('foo.txt', 'P:\\foo.txt')"
is there a way to set all values of a dictionary to zero?,{x: (0) for x in string.printable}
convert list of tuples to multiple lists in python,"map(list, zip(*[(1, 2), (3, 4), (5, 6)]))"
insert 0s into 2d array,"array([[-1, -1], [0, 0], [1, 1]])"
python: intersection indices numpy array,"numpy.argwhere(numpy.in1d(a, b))"
forcing elements in a numpy array to be within a specified range,"numpy.clip(x, 0, 255)"
trim whitespace (including tabs) in `s` on the right side,s = s.rstrip()
how to initialize nested dictionaries in python,my_tree['a']['b']['c']['d']['e'] = 'whatever'
converting a string to list in python,"x = map(int, '0,1,2'.split(','))"
pandas get position of a given index in dataframe,base = df.index.get_loc(18)
group dictionary key values in python,mylist.sort(key=itemgetter('mc_no'))
how to keep a list of lists sorted as it is created,dataList.sort(key=lambda x: x[1])
check if dictionary `l[0].f.items()` is in dictionary `a3.f.items()`,set(L[0].f.items()).issubset(set(a3.f.items()))
remove strings containing only white spaces from list,[name for name in starring if name.strip()]
replace each value in column 'prod_type' of dataframe `df` with string 'responsive',df['prod_type'] = 'responsive'
pandas: create another column while splitting each row from the first column,"df['B'] = df['A'].apply(lambda x: '#' + x.replace(' ', ''))"
create a dictionary `d` from list `iterable`,"d = {key: value for (key, value) in iterable}"
how can i create a set of sets in python?,"t = [[], [1, 2], [5], [1, 2, 5], [1, 2, 3, 4], [1, 2, 3, 6]]"
pandas: how to run a pivot with a multi-index?,"df.pivot_table(values='value', index=['year', 'month'], columns='item')"
how to filter a dictionary in python?,"dict((k, 'updated') for k, v in d.items() if v != 'None')"
pandas (python): how to add column to dataframe for index?,df = df.reset_index()
sorting list of nested dictionaries in python,"yourdata.sort(key=lambda e: e['key']['subkey'], reverse=True)"
python - how to cut a string in python?,"""""""foobar""""""[:4]"
pandas merge - how to avoid duplicating columns,cols_to_use = df2.columns.difference(df.columns)
sorting a list of tuples by the addition of second and third element of the tuple,"sorted(lst, key=lambda x: (sum(x[1:]), x[0]))"
get the value of attribute 'property' of object `a` with default value 'default value',"getattr(a, 'property', 'default value')"
is there a simple way to change a column of yes/no to 1/0 in a pandas dataframe?,"pd.Series(np.searchsorted(['no', 'yes'], sample.housing.values), sample.index)"
subtracting the mean of each row in numpy with broadcasting,"Y = X - X.mean(axis=1).reshape(-1, 1)"
efficient way to convert a list to dictionary,dict(x.split(':') for x in lis)
convert a list of booleans to string,"print(''.join(chr(ord('A') + i) if b else ' ' for i, b in enumerate(bools)))"
any functional programming method of traversing a nested dictionary?,"from functools import reduce
reduce(dict.__getitem__, l, d)"
sort numpy matrix row values in ascending order,"arr[arr[:, (2)].argsort()]"
add value to each element in array python,"[(a + i.reshape(2, 2)) for i in np.identity(4)]"
replace values of dataframe `df` with true if numeric,"df.applymap(lambda x: isinstance(x, (int, float)))"
else if in list comprehension in python3,"['A', 'b', 'C', 'D', 'E', 'F']"
can i read and write file in one line with python?,"f.write(open('xxx.mp4', 'rb').read())"
getting an element from tuple of tuples in python,[x[1] for x in COUNTRIES if x[0] == 'AS'][0]
testing whether a numpy array contains a given row,"equal([1, 2], a).all(axis=1).any()"
finding the most popular words in a list,"[('all', 3), ('yeah', 2), ('bye', 1), ('awesome', 1)]"
convert the elements of list `l` from hex byte strings to hex integers,"[int(x, 16) for x in L]"
transpose/rotate a block of a matrix in python,"block3[:] = np.rot90(block3.copy(), -1)"
creating a list of dictionaries in python,"[{'A': 1, 'C': 4, 'B': 2, 'D': 4}, {'A': 1, 'C': 4, 'B': 1, 'D': 5}]"
convert column of date objects in pandas dataframe to strings,df['DateStr'] = df['DateObj'].dt.strftime('%d%m%Y')
converting file from .txt to .csv doesn't write last column of data,writer.writerows(row.strip().split() for row in infile if row.strip())
what is the easiest way to convert list with str into list with int?,new = [int(i) for i in old]
conditional removing of duplicates pandas python,"df.drop_duplicates(['Col1', 'Col2'])"
how to add multiple values to a dictionary key in python?,"a['abc'] = [1, 2, 'bob']"
how to sort python list of strings of numbers,"a = sorted(a, key=lambda x: float(x))"
check if a python list item contains a string inside another string,[x for x in lst if 'abc' in x]
python - find index postion in list based of partial string,"indices = [i for i, s in enumerate(mylist) if 'aa' in s]"
how to delete a character from a string using python?,s = s[:pos] + s[pos + 1:]
efficient array operations in python,transmission_array.extend(zero_array)
sort list `list_` based on first element of each tuple and by the length of the second element of each tuple,"list_.sort(key=lambda x: [x[0], len(x[1]), x[1]])"
get a list of all integer points in a `dim` dimensional hypercube with coordinates from `-x` to `y` for all dimensions,"list(itertools.product(list(range(-x, y)), repeat=dim))"
how to compare elements in a list of lists and compare keys in a list of lists in python?,len(set(a))
efficient way to create strings from a list,"['_'.join(k + v for k, v in zip(d, v)) for v in product(*list(d.values()))]"
sort list `files` based on variable `file_number`,files.sort(key=file_number)
get all combination of n binary values,"lst = list(itertools.product([0, 1], repeat=n))"
"defaultdict of defaultdict, nested",defaultdict(lambda : defaultdict(dict))
sort dict by value python,sorted(data.values())
python: find the sum of all the multiples of 3 or 5 below 1000,sum([i for i in range(1000) if i % 3 == 0 or i % 5 == 0])
how to get all the values from a numpy array excluding a certain index?,a[np.arange(len(a)) != 3]
sort a dictionary `d` by length of its values and print as string,"print(' '.join(sorted(d, key=lambda k: len(d[k]), reverse=True)))"
python pandas: drop rows of a timeserie based on time range,df.loc[(df.index < start_remove) | (df.index > end_remove)]
most pythonic way to extend a potentially incomplete list,"map(lambda a, b: a or b, choicesTxt, [('Choice %i' % n) for n in range(1, 10)])"
counting unique index values in pandas groupby,ex.groupby(level='A').agg(lambda x: x.index.get_level_values(1).nunique())
sum of outer product of corresponding lists in two arrays - numpy,"np.einsum('ik,il->i', x, e)"
finding largest value in a dictionary,"max(x, key=lambda i: x[i])"
merging a list with a list of lists,[a[x].append(b[x]) for x in range(3)]
using slicers on a multi-index,"df.loc[(slice(None), '2014-05'), :]"
python parse comma-separated number into int,"int('1,000,000'.replace(',', ''))"
find the eigenvalues of a subset of dataframe in python,"np.linalg.eigvals(df.replace('n/a', 0).astype(float))"
how can i generalize my pandas data grouping to more than 3 dimensions?,"pd.concat([df2, df2], axis=1, keys=['tier1', 'tier2'])"
